{
  "schema": "buy-feature-kernel/v1",
  "merkle_root_sha256": "0ccff42741e9012029cce2fbbc7943663571e9c903e7f6dce170d3df01cf31f5",
  "generated_at_utc": "deterministic-by-merkle:0ccff42741e90120",
  "kernel": "buy_feature",
  "module": "tools.math_dsl.buy_feature",
  "industry_pattern": "BTG Bonus Buy / Pragmatic Buy Feature / Hacksaw all-buy / Push Gaming Bonus Buy / Nolimit City Feature Buy. Player pays buy_cost_x_bet × bet to immediately enter bonus. Regulator contract: UKGC RTS 13C (buy_rtp delta ≤ 0.5 pp vs base) + MGA RG 2021/02 (buy_rtp ≤ 0.96 ceiling) + disclosure UI.",
  "fixtures_count": 5,
  "records": [
    {
      "fixture_name": "fair-buy-base-rtp-match",
      "description": "buy RTP exactly equals base game RTP (regulator default)",
      "bonus_average_pay_x_bet": 96.0,
      "buy_cost_x_bet": 100.0,
      "base_game_rtp": 0.96,
      "target_buy_rtp": 0.96,
      "buy_rtp": 0.96,
      "fair_buy_cost_x_bet": 100.0,
      "delta_pp_vs_base": 0.0,
      "delta_pp_vs_target": 0.0,
      "ukgc_rts13c_pass_0p5": true,
      "ukgc_rts13c_pass_1p0": true,
      "mga_2021_02_pass_0p96": true,
      "mga_2021_02_pass_0p97": true,
      "rtp_contribution": 0.96
    },
    {
      "fixture_name": "btg-bonus-buy-100x",
      "description": "BTG Bonus Buy at 100× bet, slight buyer-side edge",
      "bonus_average_pay_x_bet": 96.5,
      "buy_cost_x_bet": 100.0,
      "base_game_rtp": 0.96,
      "target_buy_rtp": 0.96,
      "buy_rtp": 0.965,
      "fair_buy_cost_x_bet": 100.52083333333334,
      "delta_pp_vs_base": 0.5000000000000004,
      "delta_pp_vs_target": 0.5000000000000004,
      "ukgc_rts13c_pass_0p5": false,
      "ukgc_rts13c_pass_1p0": true,
      "mga_2021_02_pass_0p96": false,
      "mga_2021_02_pass_0p97": true,
      "rtp_contribution": 0.965
    },
    {
      "fixture_name": "pragmatic-buy-feature-cheap",
      "description": "cheap buy at 50× — bonus RTP higher than buy cost",
      "bonus_average_pay_x_bet": 50.5,
      "buy_cost_x_bet": 50.0,
      "base_game_rtp": 0.96,
      "target_buy_rtp": 0.96,
      "buy_rtp": 1.01,
      "fair_buy_cost_x_bet": 52.60416666666667,
      "delta_pp_vs_base": 5.000000000000004,
      "delta_pp_vs_target": 5.000000000000004,
      "ukgc_rts13c_pass_0p5": false,
      "ukgc_rts13c_pass_1p0": false,
      "mga_2021_02_pass_0p96": false,
      "mga_2021_02_pass_0p97": false,
      "rtp_contribution": 1.01
    },
    {
      "fixture_name": "ukgc-rts13c-near-limit",
      "description": "RTS 13C +0.4 pp delta — within tolerance",
      "bonus_average_pay_x_bet": 96.4,
      "buy_cost_x_bet": 100.0,
      "base_game_rtp": 0.96,
      "target_buy_rtp": 0.96,
      "buy_rtp": 0.9640000000000001,
      "fair_buy_cost_x_bet": 100.41666666666667,
      "delta_pp_vs_base": 0.40000000000001146,
      "delta_pp_vs_target": 0.40000000000001146,
      "ukgc_rts13c_pass_0p5": true,
      "ukgc_rts13c_pass_1p0": true,
      "mga_2021_02_pass_0p96": false,
      "mga_2021_02_pass_0p97": true,
      "rtp_contribution": 0.9640000000000001
    },
    {
      "fixture_name": "mga-2021-02-fails",
      "description": "buy RTP 97 % — fails MGA 0.96 ceiling",
      "bonus_average_pay_x_bet": 97.0,
      "buy_cost_x_bet": 100.0,
      "base_game_rtp": 0.96,
      "target_buy_rtp": 0.96,
      "buy_rtp": 0.97,
      "fair_buy_cost_x_bet": 101.04166666666667,
      "delta_pp_vs_base": 1.0000000000000009,
      "delta_pp_vs_target": 1.0000000000000009,
      "ukgc_rts13c_pass_0p5": false,
      "ukgc_rts13c_pass_1p0": false,
      "mga_2021_02_pass_0p96": false,
      "mga_2021_02_pass_0p97": true,
      "rtp_contribution": 0.97
    }
  ],
  "verification": "Re-run `python -m tools.build_buy_feature_kernel`. Output must match `merkle_root_sha256` exactly. Closed-form: buy_rtp = bonus_pay/cost, fair_cost = bonus_pay/target_rtp, delta_pp = (buy_rtp - base_rtp) × 100."
}